{
  "id": "dev.litools.hello-world",
  "name": "Hello World",
  "version": "0.1.0",
  "description": "Example litools plugin",
  "author": "litools contributors",
  "entry": "dist/index.html",
  "icon": "dist/icon.svg",
  "commands": [
    {
      "id": "hello",
      "title": "Hello World",
      "subtitle": "Open the example plugin view",
      "keywords": ["hello", "example"],
      "mode": "view"
    }
  ],
  "permissions": ["ui:window"]
}
